nom,texte
Eleanor_Darhk_,"Nora Darhk is the wife of Ray Palmer and the daughter of the H.I.V.E. leader Damien Darhk. After her father was killed by the Green Arrow, Nora was sent to Sumner Asylum and was possessed by the time demon Mallus. Years later, she inherited her father's powers and became a member of his cult to resurrect him and bring Mallus back. After Damien sacrificed himself to save her, Nora redeemed herself and joined the Legends, eventually becoming the new Fairy Godmother after taking over from the old one."
Eve_,"Eve was one of the original humans created by God during the Dawn of Time. She was originally created to be the second wife of Adam following the banishment of Lilith, Adam's first wife. After Eve fled Heaven and came to Earth millennia later, she briefly rekindled her relationship with Lucifer and later became a bounty hunter along with Mazikeen of the Lilim, who would later become her wife."
Father_Sea_,"Father Sea is the primordial patriarch of all ocean gods and late husband of Mother Salt. When murderous ire towards his children's recreational advances killed him, he would return as an ally/reminder of the sea god's obligation to the oceans majesty by ferrying haughty & complacent deep divinity to Unspoken Water."
Flying_Fox_,"The Flying Fox is a former member of the superhero team the Young All-Stars,[1] who later gained employment with the hero-for-hire service Heroz4U. Though his performance was poor, the Flying Fox had little in life but his work, and remained with the company for ten years until it was shuttered by the arson of its headquarters in Metropolis.[2]"
Franklin_Clay_,"Lt. Col. Franklin Clay was the commander of a clandestine Black Ops team that worked for the CIA in the War on Drugs and later, the War on Terror. After their handler, Max, betrayed them, Clay took the team underground and set out to stop many of Max and the CIA."
Franklin_Rock_,"Sgt. Franklin ""Frank"" Rock was the authority figure within his unit, Easy Company, during World War II. The unit was made up of a disparate collection of individuals who managed to participate in every major action in the European Theatre. Throughout the gruelling conflict, Rock developed a loathing for warfare but also creating a strong bond and deep sense of loyalty with the men of Easy Company."
Frau_Totenkinder_,"Frau Totenkinder is the leader of the of Fabletown. She is the Black Forest Witch from the Hansel and Gretel story. Her outward appearance as a rather frail old woman masks the fact that she is one of the most powerful Fables to have escaped the Homelands, and she could, in all probability, hold her own against most of those mages working for the Adversary."
Frederick_Freeman_,"Freddy Freeman is a young man who owns and operates his own corner newsstand. Crippled from an accident, Freddy Freeman has only to say the magical word Shazam in order to turn into the mighty Captain Marvel, Jr. Together with the Marvel Family, Freddy fights to defend Fawcett City from the likes of Doctor Sivana and his Sivana Family."
Frederick_Freeman_,"Freddy Freeman was an average teenager and fan of Captain Marvel until he was paralyzed after an encounter with Captain Nazi. He would later find himself empowered by his best friend and secret idol, Billy Batson, as Captain Marvel, Jr., later shortened to CM3.  Eventually, he would advance to become the new magical champion of Earth under the name Captain Marvel. Freddy has prominently served as a member of the Marvel Family and the Teen Titans."
Frost_,"Frost was Caitlin Snow's evil alternate personality. After redeeming herself, she acted as a hero and a member of the Team Flash, possessing Caitlin whenever her powers were needed and, eventually, living her own life. After being hit by Mirror Monarch, she was separated from Caitlin, but was later killed by Deathstorm."
Ganthet_,"Ganthet is one of the Guardians of the Universe. However, while most of the Guardians are very unemotional and distanced, Ganthet has a personality that is more human-like, including displays of empathy and concern for an individual, instead of only thinking of the Green Lantern Corps. Ganthet is part of the Quintessence, a group of near-omnipotent beings who oversee the results of what happens on Earth."
Garth_Ranzz_,"When Garth, Ayla and Mekt crash-landed their spaceship on the planet Korbal, Ayla suggested that they could use the local lightning beasts to recharce the batteries of the ship. They were unsuccessful, and they were attacked by the beasts. The beasts caused the siblings to gain electrical powers. Garth was later at the founding of the Legion of Super-Heroes."
Garth_Ranzz_,"This version of Garth Ranzz is one of the Batch SW6 Legionnaires, a younger version of the Legion's existing adult Garth Ranzz introduced during the ""Five Years Later"" era. Batch SW6 were originally believed to be clones created by the Dominators, but later revealed as time-paradox duplicates engineered by the Time Trapper. The events of Zero Hour erased them and their adult counterparts, replacing them with the Reboot Legion."
Gim_Allon_,"This version of Gim Allon is one of the Batch SW6 Legionnaires, a younger version of the Legion's existing adult Gim Allon introduced during the ""Five Years Later"" era. Batch SW6 were originally believed to be clones created by the Dominators, but later revealed as time-paradox duplicates engineered by the Time Trapper. The events of Zero Hour erased them and their adult counterparts, replacing them with the Reboot Legion."
Gus_,"Gus (acronym for Genetic Unit Series 1) is the first Hybrid kid created by Dr. Gertrude Miller before the H5G9 virus pandemic. A year after his ""father's"" death, Gus decided to find his ""mother"" with the help of the former Last Man Thomas Jepperd, which nicknamed Gus as ""Sweet Tooth"" due to his obsession with candies."
Hal_Jordan_,"Hal Jordan is the most well-known Green Lantern. He was the first human ever inducted into the Green Lantern Corps, and has been heralded as possibly the greatest Green Lantern of all time. Hal is also a founding member of the Justice League of America. He has also been known as Parallax and The Spectre."
Harley_Quinn_,"Harley Quinn is the jester of the Castle of El. She is also an advisor to Queen Lara and tries to act as the voice of peace and restraint at court. Harley is in a romantic relationship with Ivy, a witch who lives in Hobb Forest near the Castle of El."
Harrison_Wells_,"Harrison ""H.R."" Wells was the Wells of Earth-19. Initially contacted to serve as a replacement Wells for Team Flash at S.T.A.R. Labs, along with several other Wells across the multiverse, H.R. eventually was exposed for being a fraud of a scientist, and everything fell apart for him on his Earth. Regardless, H.R. would assist in Team Flash's fight against the evil speedster, Savitar."
Harrison_Wells_,"Harrison ""Harry"" Wells was the Wells of Earth-2. A celebrated scientist and founder of S.T.A.R. Labs, Wells traveled to Earth-1, seeking Barry Allen's help to save his daughter Jesse, who was kidnapped by the meta-human speedster Zoom. Harry continued working with Team Flash as its main scientific mind to defeat Zoom, Savitar, and Clifford DeVoe."
Hartley_Rathaway_,"Hartley Rathaway is an expert in psychoacoustics and sonic vibrations who used to work for S.T.A.R. Labs. He was fired by ""Harrison Wells"" for trying to stop him from activating the Particle Accelerator, and came back as the Pied Piper seeking revenge, wanting to kill The Flash for believing that Wells replaced him with the new pupil."
Harvey_Bullock_,"Harvey Bullock was a detective in the Gotham City Police Department. Despite their different methods, he is a good friend and ally of Jim Gordon, and filled his place as Commissioner when he went missing.[1] He wound up resigning from the force due to a difference in priorities with the Gotham City mayor during the events of The Joker War.[2]"
Heino_Okata_,"Most Excellent Super Bat (Heino Okata) is the leader of the Super Young Team. He wears a wildly stylized red and yellow uniform influenced by both Superman and Batman. According to him, his power is ""being rich"".[1] He uses an array of gadgets and has some training in the martial arts."
Helena_Bertinelli_,"The Huntress is a vigilante operating out of Gotham City, and a member of the Batman Family. She is also a devout Catholic, and is very in touch with her Italian heritage. Her career is inspired by a personal vendetta against organized crime, responsible for killing her entire family. At first, her ruthless methods and willingness to kill made her an outcast from the heroic community, but in time she learned to temper her methods and became accepted by her peers. She has also been a member of the Justice League and the Birds of Prey."
Helena_Kosmatos_,"The Erinyes (Alecto, Tisiphone and Megaera) granted 15-year-old Helena Kosmatos a portion of their power so that she could seek revenge on the Nazis who had killed many of those she loved in her Greek village. Escaping to the United States at 16, she used her powers as a member of the Young All-Stars. However, the Erinyes had not told her of the price of her power—when she became angered, she would be taken over by one of the monstrous Furies."
Helena_Wayne_,"Helena Wayne is the daughter of Batman and Catwoman from an averted future where her father was murdered as a result of the schemes of the time-traveling Per Degaton. She then joined the Infinity, Inc. and the Justice Society of America as the heroine known as the Huntress. As a temporal remnant of a future that is no longer possible, she exists as a living paradox on Earth 0."
Henry_Cosgei_,"Henry Cosgei is a former renown professional athlete hailing from Kenya and considered one of the greatest runners in his generation. Selected to be an operative of T.H.U.N.D.E.R, he was framed for a false positive drug test, potentially ending his career. With promises of restoring his former status, Henry became T.H.U.N.D.E.R's speedster, Lightning."
Henry_Hall_,"Hank Hall was the first Hawk. In contrast to his brother Dove who represents order and peace, he represents chaos and war. During Armageddon 2001, he became the supervillain Monarch and during Zero Hour he became known as Extant, one of the most powerful beings in the universe wielding the combined energies of both Hawk and Dove."
Henry_Hall_,"Hank Hall is Hawk, an avatar of War who gets his power from the Lords of Chaos. He and the avatar of Peace Dove protect Washington, D.C. as the crime fighting duo Hawk and Dove. Hawk and Dove have been members of the Teen Titans as well as its successor team the Titans."
Hollis_Mason_,"Hollis Mason was the first Nite Owl, a member of the Minutemen in the 1940s. Once a police officer inspired by the thought of excitement and adventure being a vigilante brought, Mason eventually retired to be a car repairman, and wrote a tell-all book about his former team titled Under the Hood. Soon after, he trained a successor Nite Owl in Dan Dreiberg."
I.Z.O.R._,"I.Z.O.R. aka Gear is a member of the Legion of Superheroes. Gear is a member of the Lisnarian who hale from the planet Lisnar, they are known galaxywide for their ability to generate gadgets from their techno-organic bodies. The species are hired as living tools, as was the case for Gear."
Imra_Ardeen_,"This version of Imra Ardeen is one of the Batch SW6 Legionnaires, a younger version of the Legion's existing adult Imra Ardeen introduced during the ""Five Years Later"" era. Batch SW6 were originally believed to be clones created by the Dominators, but later revealed as time-paradox duplicates engineered by the Time Trapper. The events of Zero Hour erased them and their adult counterparts, replacing them with the Reboot Legion."
Indigo-1_,"Indigo-1 was the leader of the Indigo Tribe; the group that wields the indigo light of compassion. Unlike the other Corps, the Tribes does not have a traditional uniform. Instead she has tattooed the symbol of her Tribe all over her body, as do members of the Tribe. Indigo-1 and her tribe speak the Nokian language that is unknown even to the Green Lantern Ring, which is supposed to be a universal translator for every language. In addition to a power ring, Indigo-1 and her Tribe wield a coral-like staff that acts as their power battery and energy conduit."
Jack_T._Chance_,"Jack T. Chance is a member of the Green Lantern Corps assigned to Sector 17, one of the worst, most troubled criminal sectors in the universe. Born of the hellhole Garnet, Chance's ruthless tactics earn him many reprimands from the Guardians of the Universe... but it's agreed that only a man as bad as he is could tame a sector as tough as the one he's been given. While other Green Lanterns wear a full uniform, Chance wears a trench coat, and simply sticks a pin with the Corps logo on his lapel. In addition to his power ring, he also carries a gun."
Jackson_Hyde_,"Jackson Hyde is the third Aquaman. He is the partner and former protege of Arthur Curry, the second Aquaman. Prior to becoming Aquaman, he was the second hero to use the name Aqualad and a member of the Teen Titans for a short time. He is the son of Black Manta and the Xebelian rebel Lucia. Jackson is openly gay."
James_Gordon_,"Commissioner James ""Jim"" Gordon was a detective in the Gotham City Police Department. After fighting numerous freaks and madmen, occasionally working alongside criminals like the Riddler and his nemesis, the Penguin to combat greater threats such as the Valeska twins and the Court of Owls, and leading Gotham City as best he could through crisis after crisis, he eventually became the police commissioner."
James_Gordon_,"James Worthington ""Jim"" Gordon was the commissioner of the Gotham City Police Department, before being replaced by Harvey Bullock for a brief period, and is an ally to Batman. He is the father of Barbara Gordon and James Gordon Jr., and he is the ex-husband of Barbara Eileen.  He eventually retired, taking a role as a private investigator."
Jan_Arrah_,"This version of Jan Arrah is one of the Batch SW6 Legionnaires, a younger version of the Legion's existing adult Jan Arrah introduced during the ""Five Years Later"" era. Batch SW6 were originally believed to be clones created by the Dominators, but later revealed as time-paradox duplicates engineered by the Time Trapper. The events of Zero Hour erased them and their adult counterparts, replacing them with the Reboot Legion."
Janet_Fals_,"Janet Fals died during the Dark Multiverse invasion, but her father used his CIA connections to bring her back to life, releasing her remains to Civil Solutions, a futurist arms developer, who resurrected her with a new heart called the ""Conflict Engine"". The device requires her to start fights to stay alive, meaning she could not return to her old life or identity. She quenches her needs by fighting in underground matches as Firebrand."
Jason_Garrick_,"Jay Garrick is a superhero speedster known as The Flash, and he is a member of the Flash Family. When his fellow speedster Wally West was possessed by a mysterious entity, he had his powers removed like the rest of the Flash Family. Jay worked with the Family to use their Rogue's gadgets against their former friend."
Jason_Garrick_,"Jason ""Jay"" Garrick is the first speedster to be called The Flash, and a founding member of the Justice Society of America. As a result of Doctor Manhattan's alterations to the timeline, Jay became trapped in the Speed Force and forgotten to all,[1] though eventually the alterations were undone and Jay was restored alongside the rest of the world's proper history.[2]"
Jay_Nakamura_,"Jay Nakamura is the boyfriend of Jon Kent and a Gamorran refugee living in the United States. He has a keen interest in journalism and activism, and anonymously runs an underground journalism site called The Truth[1] for an eponymous activist group he leads under the code name Gossamer.[2] Due to experimentation against his will by Henry Bendix, Jay is also a ""post-human"" with artificially created metahuman abilities.[3]"
Jean-Paul_Valley_,"Named after the Angel of Death, most of his extraordinary abilities come from severe amounts of subconscious training and conditioning he was put through during his youth, unaware that he was being controlled by a 500-year old devout religious sect called the Order of St. Dumas that his ancestors had belonged to for generations."
Jeremy_Horton_,"Jeremy Horton is a powerful telekinetic and telepath who went by the name Hard Drive. The main limitation of his telepathy is that he can't compel anyone to do something they didn't already want to do. He used his telepathy to become rich by securing business deals, and also to put together his team, the Young Heroes."
Jesse_Wells_,"Jesse Chambers Wells, better known as Jesse Quick, was the daughter of Harrison Wells of Earth-2, and the speedster hero of Central City. Initially a human college student abducted by the metahuman speedster Zoom, Jesse gradually managed to unlock her Speed Force connection after being hit by a dark matter wave from the S.T.A.R. Labs particle accelerator, later becoming a speedster herself and her Earth's superhero. Jesse briefly dated Wally West and helped Team Flash in their fight with Zoom and Savitar."
Jo_Nah_,"This version of Jo Nah is one of the Batch SW6 Legionnaires, a younger version of the Legion's existing adult Jo Nah introduced during the ""Five Years Later"" era. Batch SW6 were originally believed to be clones created by the Dominators, but later revealed as time-paradox duplicates engineered by the Time Trapper. The events of Zero Hour erased them and their adult counterparts, replacing them with the Reboot Legion."
Jonah_Hex_,"Jonah Hex was a legendary bounty hunter on the American western frontier in the 19th Century. His reputation as the deadliest man alive followed him everywhere, and he killed hundreds of men up until his death. Hex was a gruff anti-hero with a deep personal code of honor that kept him on the side of good despite his violent tendencies."
Jonathan_Osterman_,"Doctor Manhattan (real name Jon Osterman) was a loving but distant godlike being who protected the United States from threats for years. Transformed by a particle test, he acted as a superhero, a scientist, and even created a new species, but eventually grew bored of being a god and hid among humanity with his wife, Angela Abar."
Jonathan_Samuel_Kent_,"Upon returning home, Jon became the new Superman in the place of his father, who had departed the planet indefinitely on a mission to Warworld. As the first Earth-born Superman, Jon sought to use the role to help in new ways for ""truth, justice, and a better world."" Eventually, Jon began dating the post-human reporter Jay Nakamura."
Joseph_Wilson_,"Joseph W. ""Joey"" Wilson is the second son of Adeline Kane and  Slade Wilson, from whom he inherited his metahuman gene. He has been mute since childhood, when one of his father's enemies cut his throat.[4] Joey eventually became the vigilante hero known as Jericho, and in the business world, he is the Executive Vice President of Core Policy Group.[1] He has been a member of the Teen Titans, the Justice League Reserves and the Defiance."
Juggler_,"Juggler was one of several convicts held prisoner in a United States army stockade in the early years of World War II. Lt. Benjamin Hunter selected Juggler to become part of a Special Forces unit code-named Hunter's Hellcats. Although lacking in moral fiber, the acrobatic Juggler faithfully served under Lt. Hunter throughout the remainder of the war."
Kal-El_,"Superman (born Kal-El, real name Clark Kent) is a compassionate, gentle, and altruistic Kryptonian superhero and a Daily Planet reporter in his civilian identity. After being overdosed with radiation, he came to contemplate his life and values in an attempt to make his final adventures as meaningful as possible, performing twelve impossible feats and inspiring the Superman Squad in the future."
Kal-El_,"The Superman of the 853rd Century survived by becoming the living extension of the Sun. He left the Earth somewhere in the late 21st Century when everyone he cared about died. He traversed the entire DCU, going beyond time and space, and has been said to have reached as far as Heaven and Hell themselves."
Kal-El_,"Superman is one of the surviving members of the Justice League of America. Though he fought nobly, he soon fell victim to the Anti-Life Equation and became one of the Anti-Living. After about 5 years of being Anti-Living, he is finally able to be cured and returned to normal thanks to the efforts of his son and the remaining heroes."
Kal-El_,"Superman is the most powerful being on Earth, an alien immigrant named Kal-El from the planet Krypton who was raised in Smallville, Kansas, to become an American superhero. Raised with high moral ideals, he uses his incredible strength, speed, flight and various other superpowers to fight evil and to protect the innocent. In his civilian identity he is Clark Kent, a mild-mannered reporter working for the Daily Planet in Metropolis. He is a founding member of the Justice League of America."
Kal-El_,"Superman (real name Clark Kent, born Kal-El) is a noble, kind, and gentle Kryptonian superhero who uses his great power to protect the city of Metropolis, and Earth as a whole, from threats such as Lex Luthor, General Zod and the Nuclear Man. In his civilian identity, he acts as a mild-mannered reporter for the Daily Planet, where he works alongside spunky reporter Lois Lane."
Kal-El_,"Superman is Earth's first and premiere superhero, and its stalwart protector. Born Kal-El on the distant planet Krypton, he was sent to Earth as a child to survive Krypton's destruction, where he gained fantastic powers under its yellow sun. Raised to believe his abilities would one day put him in a position to help others, he uses his extraordinary superpowers to fight evil and protect the innocent. In his civilian identity he is Clark Kent, a mild-mannered reporter working for the Daily Planet in Metropolis."
Kal-El_,"Kal-El survived the destruction of his homeplanet of Krypton by being rocketed to Earth. He was found and adopted by Martha and Jonathan Kent, who gave him the name Clark Kent. Due to his alien physiology, Clark developed superpowers. He used his abilities as the superhero Superman and as a member of the Super Friends.[1]"
Kal-El_,"Superman is Earth's premier superhero and the stalwart protector of Metropolis. Born Kal-El on the distant planet Krypton, he was sent to Earth as a child to survive Krypton's destruction. Raised with high moral ideals, he uses his extraordinary superpowers to fight evil and protect the innocent. In his civilian identity he is Clark Kent, a mild-mannered reporter working for the Daily Planet in Metropolis."
Kal-El_,"Superman, born Kal-El and legally named Clark Joseph Kent, is the last son of Krypton, sent as the dying planet's last hope to Earth, where he grew to become its protector. He is now the main attraction of Mongul's arena, where without his powers he must fight to keep on living."
Kal-El_,"Superman is the most powerful being on Earth,[2][3][4][5][6] an alien refugee named Kal-El from the planet Krypton who was raised in Smallville, Kansas, to become an American superhero. Raised with high moral ideals, he uses his incredible strength, speed, flight and various other superpowers to fight evil and to protect the innocent. In his civilian identity he is Clark Kent, a mild-mannered reporter working for the Daily Planet in Metropolis. He is a founding member of the Justice League of America and a member of the Legion of Super-Heroes in the 30th Century."
Kal-El_,This incarnation of Superboy was born into a singularly created universe who was developed by the Time Trapper as part of his scheme to control the Legion of Super-Heroes after the Earth-One Superboy was wiped from existence due to the effects of the Crisis on Infinite Earths and replaced with the current Superman who was never costumed Superboy.
Kal-L_,"Kal-L is the last Kryptonian, and the hero known as Superman. Unlike his Earth-1 counterpart, this version is a more adult one whose adoptive parents (Jonathan and Martha Kent) died in an accident; so he was raised an orphan. In World War II, he was an ally of the Justice Society of America, infusing himself under the code name ""Shakespeare""."
Kaldur'ahm_,"Kaldur'ahm is the second Aquaman and the former Aqualad. He is the former protege and successor of Orin, the King of Atlantis and the previous Aquaman. He is the son of the villain Black Manta and an Atlantean woman called Sha'lain'a. He was raised by her and his step-father Cal Durham, who he believed was his biological father."
Kara_Zor-El_,"Kara Zor-El is Supergirl, a member of the Justice League of the Li'l Leaguers universe, a timeline happier and less dark than the main universe. Kara is a sweet, polite and innocent child who is fond of streawberries and can not stand when her friends fight each other. Luckily their arguments use to be short-lived because her teammates are deadly frightened of her devastating sonic cries."
Kara_Zor-El_,"Kara-Zor-El is the heroine known as Supergirl. Born on Krypton to Superman's uncle and aunt, Kara was rocketed to Earth by her father to save her life. She was adopted by the Danvers family and became the protector of National City. In her secret identity she is Kara Danvers, a run-of-the-mill high-schooler. Possessing vast powers given by her Kryptonian physiology, Supergirl is one of the most powerful heroes in the world, and has been a member of the Justice League and the Red Lantern Corps."
