nom,texte
Kara_Zor-L_,"Power Girl is the Earth-Two counterpart of Supergirl and first cousin to Kal-L, the Superman of Earth-Two. Power Girl took her cousin's place in the Justice Society of America after he entered into semi-retirement to focus on his personal life. Her survival of Crisis on Infinite Earths and adapting to a new world caused her some confusion as to her roots. She believed for a time she was descended from Arion, Lord of Atlantis, but following the Infinite Crisis she learned her original legacy still held true."
Kara_Zor-L_,"Power Girl was the Supergirl of Earth-Two and the cousin to its Superman, where she had a daughter-like relationship with him and his wife Lois Lane. A survivor of the original Crisis on Infinite Earths, Kara settled on the surviving Earth following the original collapse of the multiverse and became a member of the Justice Society of America. In her civilian identity on Earth, she is known under the names Karen Starr and Paige Stetler.[1]"
Kay_Challis_,"Crazy Jane is an aggressive, closed-off member of the Doom Patrol, and the primary persona of Kay Challis, a woman with sixty-four unique personalities each granted a unique metahuman ability by Niles Caulder. After managing to put the puzzle together and come to terms with herself, Kay merged with all the personalities into a single being called Kaleidoscope.[2]"
Kay_Challis_,"Crazy Jane is the dominant alternate personality of Kay Challis, who has dissociative identity disorder, with a total of 64 unique identities. As a result of exposure to the alien Dominators' ""gene bomb,"" each of her 64 alternate personalities has a different super-power. While Jane initially believed that she was the only one without a metahuman ability, this was later proven false. She eventually discovered that she had the ability to heal others (whether this healing is primarily emotional or physical is unknown)."
Kent_Nelson_,"Dr. Kent Nelson is Doctor Fate, a powerful sorcerer and agent for the Lords of Order who fights evil alongside his wife Inza. His amulet, cloak and helmet are creations of the ancient Nabu who acts as his mentor and spiritual guide. He is a founding member of the Justice Society of America."
Khalid_Ben-Hassin_,"Khalid Ben-Hassin was the vessel for Nabu, a Egyptian mage whose powers flowed through the Helmet of Fate. As Doctor Fate, he is a member of the Wonders of the World and was a powerful sorcerer. After the destruction of the helm, he later worked as an ambassador for the World Army."
Kirk_Langstrom_,"Dr. Kirk Langstrom is the inventor of the infamous Man-Bat Serum, a special formula that has the ability to turn the user into a hideous bat monster, the Man-Bat. Though he originally created it to help the deaf and blind, because of its temporary side effects, multiple people have taken advantage of it, including Langstrom himself, often in the name of vigilantism. However, because the user becomes almost feral with its use, Langstrom has acted as both an ally and enemy to Batman."
Kon-El_,"Superboy, also known as Kon-El and Conner Kent, is a genetic clone of Superman and Lex Luthor. Superboy was trapped on Gemworld during the Flashpoint, resulting in a second iteration, a genetic clone of Jon Lane Kent coming to existence during his absence. Eventually, however, the original was rescued from Gemworld by his friends. The two versions of Superboy were later merged into one being. He has been a member of Young Justice and Teen Titans and eventually became the boyfriend of Miss Martian."
Kong_Kenan_,"Kong Kenan is the Super-Man of China. Initially a self-centered bully who cared only for himself, Kenan was changed after standing up to Blue Condor and receiving the powers of Superman, whom he greatly respects. Kenan is brash, headstrong and frequently rushes into situations without thinking, although he has the best of intentions."
Koriand'r_,"Koriand'r is an alien princess from the planet Tamaran who lived in peace and happiness until her home planet was conquered. Banished from Tamaran, Koriand'r was enslaved and experimented on, granting her extraordinary powers which she used to lead a rebellion and liberate herself and her fellow slaves from their captors. She became known throughout the cosmos as Starfire, and settled on Earth, where she became a member of the superhero teams the Outlaws and the Teen Titans."
Koriand'r_,"Koriand'r, known on Earth as Kory Anders, is a princess warrior from Tamaran who was sent to Earth to stop the demon Trigon from destroy the worlds. Her mission was hampered by memory loss, but she got it back after she joined the Titans, and after Trigon was defeated, she decided to stay on Earth acting as the superheroine Starfire."
Krypto_,"This incarnation of Krypto was born into Pocket Universe, a singularly created universe which was developed by the Time Trapper. That universe was part of Trapper's scheme to control the Legion of Super-Heroes after the Earth-One Superboy was wiped from existence due to the effects of the Crisis on Infinite Earths and replaced with the current Superman who was never costumed Superboy. Krypto was Superboy's kryptonian dog."
Kyle_Rayner_,"Kyle Rayner is a high-ranking member of the Green Lantern Corps from Earth. After the rest of the Corps was destroyed, he alone was selected to bear the last power ring and carry on the title. Although he acted alone for many years, when the Corps was reformed, his skill level gave him a position as an Honor Guard, only behind Salakk and the Guardians in the chain of command of the Corps. He has also been a host for the Ion entity, and a member of the Justice League."
Lady_Beauty_,"Lady Beauty is the wife of Lord Beast and a Lamia who killed a beautiful woman and took the her form in order to adopt a peaceful and simple way of life. Beauty and her husband Beast eventually fled the Homelands and moved to Fabletown, where they found new jobs and had a daughter named Bliss."
Lar_Gand_,"This version of Lar Gand is one of the Batch SW6 Legionnaires, a younger version of the Legion's existing adult Lar Gand introduced during the ""Five Years Later"" era. Batch SW6 were originally believed to be clones created by the Dominators, but later revealed as time-paradox duplicates engineered by the Time Trapper. The events of Zero Hour erased them and their adult counterparts, replacing them with the Reboot Legion."
Laurel_Gand_,"This version of Laurel Gand is one of the Batch SW6 Legionnaires, a younger version of the Legion's existing adult Laurel Gand introduced during the ""Five Years Later"" era. Batch SW6 were originally believed to be clones created by the Dominators, but later revealed as time-paradox duplicates engineered by the Time Trapper. The events of Zero Hour erased them and their adult counterparts, replacing them with the Reboot Legion."
Lawrence_Trainor_,"The Negative Man (real name Larry Trainor) was an Air Force test pilot fused to an alien negative spirit and made radioactive, forcing him to wear lead-lined bandages, and influencing him to join the Doom Patrol. Chipper and optimistic, but easily frustrated, Larry's physical and emotional evolution was eased along by his teammates and friends over the years."
Lawrence_Trainor_,"The Positive Man (real name Larry Trainor) is a chipper and friendly superhero and member of the Doom Patrol, able to project positive energy into the universe and alter reality with it. He is the former host of the negative spirit Keeg Bovo, who he would release from his body and guide as the Negative Man."
Lian_Harper_,"Lian Harper is the daughter of Arsenal and Cheshire. When she was a child her death was faked by Amanda Waller and she spent years being unwillingly teleported across time and space. She eventually ended up living on the streets of Gotham City, using the name Shoes. As a teenager she adopted the vigilante identity Cheshire Cat and was Catwoman's sidekick for a time, before finally reuniting with her father and her family Team Arrow."
Light_Fingers_,"Light Fingers was one of several convicts held prisoner in a United States army stockade in the early years of World War II. Lt. Benjamin Hunter selected Light Fingers to become part of a Special Forces unit code-named Hunter's Hellcats. Although lacking in moral fiber, the former pick-pocket faithfully served under Lt. Hunter throughout the remainder of the war."
Lois_Lane_,"Lois Lane is a Pulitzer-prize winning investigative journalist employed at the Daily Planet. Raised in the military as the daughter of General Sam Lane, she is more than capable of handling herself in almost any situation, though this doesn't stop her from commonly being abducted by super-villains. She is the long-time romantic interest and eventual wife of Superman. She is also the mother of their son Jonathan Samuel Kent."
Lois_Lane_,"Lois Lane is a world-famous investigative journalist employed at the Daily Planet, alongside fellow reporter Clark Kent, photographer Jimmy Olsen and the Daily Planet editor-in-chief Perry White. Raised in the military as a daughter of General Sam Lane, she is more than capable of handling herself in almost any situation. She is one of Superman's fiercest and most dedicated allies."
Lord_of_the_Dance_,"Lord of the Dance is the spirit-lord of ancient delight and festivities. As the Catholic Church outlawed Pagan feasts to encourage the celebration of Christmas, the Lord of the Dance was forgotten by history. He wandered the Earth for centuries, waiting for someone to notice his presence. John Constantine helped him regain his might and claim once again his old title."
Luornu_Durgo_,"This version of Luornu Durgo is one of the Batch SW6 Legionnaires, a younger version of the Legion's existing adult Luornu Durgo introduced during the ""Five Years Later"" era. Batch SW6 were originally believed to be clones created by the Dominators, but later revealed as time-paradox duplicates engineered by the Time Trapper. The events of Zero Hour erased them and their adult counterparts, replacing them with the Reboot Legion."
Lyla_Michaels_,"Mar Novu transforms her in the Harbinger in order to make her a major player in the Crisis on Infinite Earths. After the Crisis was averted, however, she loses her powers. When Team Arrow disbands due to there no longer being a need for them, Lyla transfers to the Metropolis branch and moves alongside her husband and children."
Lyle_Norg_,"This version of Lyle Norg is one of the Batch SW6 Legionnaires, a young version of the Legion's existing deceased Lyle Norg introduced during the ""Five Years Later"" era. Batch SW6 were originally believed to be clones created by the Dominators, but later revealed as time-paradox duplicates engineered by the Time Trapper. The events of Zero Hour erased them and their adult counterparts, replacing them with the Reboot Legion."
Mara_,"Mara is a former adventurer and shape-changer hailing from the city of Thamuz who became one of the 4 allies of Arion alongside Lady Chian and Wyynde. After countless adventures and the destruction of Atlantis, she would assume the form of a dog just as Darkworld disappeared from the universe, trapping her in the form."
Marc_Slayton_,"Marc Slayton was Backlash is a half-Kherubim superhero who has had a number of powers over the years, most notably changing into a mist and psychokinesis. He was a member of Team 7, StormWatch and Wildcore before becoming the director of International Operations. His daughter Jodi briefly also operated under the name."
Marcus_Aelius_,"Alpha Centurion is a Roman superhero, who gained his powers from years of extensive alien training after winning games organized in honor of Virmiru by Emperor Hadrian. Due to the unique properties of intergalactic travel, he returned to Earth almost 2,000 years later, and became a resident of Metropolis, where he would meet Superman and became a trusting ally over-time, having developed immense respect for him."
Marcus_Robbins_,"Marcus Robbins is a member of The Freedom Fighters. As a black man, he saw his family and his people treated as sub-citizens by the Nazi regime, where black people received yellow numbered labels on their ears as if they were cattle and were recruited for low-skilled jobs as slaves, being usually treated very violently by their so-called superiors. Because of this he grew up a young man with desire for justice as the second Black Condor of the Freedom Fighters.[1]"
Mary_Bromfield_,"Mary Bromfield is a girl in the Philadelphia foster care system, raised by Victor and Rosa Vasquez. She is the oldest of the Vasquez children and acts as a sort of den mother for the other children. Eventually, Mary and her foster siblings gained the powers of Shazam, making them superheroes.[1]"
Mary_Bromfield_,"Mary Bromfield is Mary Marvel. She became one of the Seven Champions of Magic and a member of the Shazam Family along with the Vasquez foster family after her adoptive brother Billy Batson gave her superpowers.  Mary later became the new champion of Shazam and was given the full power of the Shazam family.  Following the Lazarus Eruption, Mary retook the name Mary Marvel."
Mia_Mizoguchi_,"Mia ""Maps"" Mizoguchi is an excitable and curious Gotham Academy student. She is the founder of the academy's secret ""Detective Club"", which investigates the unusual and occasionally supernatural occurrences at the school. She idolizes Batman for his ingenuity and detective skills, and hopes to become his protégé as Robin. Maps also has a deep love of fantasy, exploration, and cartography -- the latter being source of her nickname."
Mia_Queen_,"Mia Queen, alias Green Arrow, is a vigilante and a member of the Canaries from a possible future on Earth-Prime. In the original timeline on Earth-1, her name was Mia Smoak, a former underground cage fighter also known as Blackstar, who saved Star City with the new Team Arrow. She is the daughter of Oliver Queen and Felicity Smoak, and the half-sister of William Clayton."
Michael_Carter_,"Michael Carter, alias Booster Gold was born on December 29th, in the year 2442. Using the technology he stole from the 25th Century, Michael became a superhero saving the life of the President of the United States Ronald Reagan on his first adventure.  This act rewarded him with instant fame, which he cashed in on, becoming quite wealthy.  Unfortunately, Booster's manager stole a large amount of his money, leaving him with only a little."
Michael_Lane_,"Michael Lane is a vigilante trained as part of a secret GCPD program to create a potential replacement for Batman. This experiment drove its participants insane and they eventually became the Three Ghosts of Batman, with Lane becoming the villainous Bat-Devil. The Order of Purity would later take him in as their agent Azrael, a deadly assassin working in God's name."
Michael_Maxwell_,"B'wana Beast, Mike Maxwell, was a superhero of the jungle. He has the ability to merge the best qualities of animals into composite creatures with incredible powers, which he controls. His helmet, and an elixir he drinks, transform him into a taller and more powerful man than in his civilian identity as a ranger."
Michael_Morice_,"As the embassy chief of the British embassy of the Justice League International, Michael Morice was eccentric, demanding, incompetent, tactless and inflexibly attached to routine. In addition to running the embassy, he had ambitions to be a superhero, using a power stick which was allegedly used by his father during the Second World War to inflict damage on the Nazi forces."
Miguel_Montez_,"Miguel is the current owner of the H-Dial, a mysterious device resembling a retro telephone that allows the user to transform into a super-hero by dialing the letter ""H"". Owning the phone has brought many dangers along with it, primarily the Thunderbolt Club, an organization made up of former H-Dial users who seek to wield its power once again."
Mona_Wu_,"Mona Wu was the delivery girl and assistant coordinator of creature upkeep at the Time Bureau, until she was scratched by her lover Konane, turning her into a human-kaupe hybrid with a split personality named Wolfie. After she was fired from the bureau, Mona joined the Legends, but leaves the team after Mick Rory appoints her as his successor as the romance novelist ""Rebecca Silver""."
Nabu_,"Nabu the Wise was a Lord of Order and cosmic being who arrived at Earth billion of years ago to take a proactive role in battling the Lords of Chaos. A cosmic being with near limitless magical power, his spirit resides in the Helmet of Fate and is the source of the great power hold by those whom bear the mantle, Doctor Fate."
Natalie_Lane_Irons_,"Natalie ""Nat"" Lane Irons is the daughter of John Henry Irons and Lois Lane from an alternate Earth destroyed by her world's version of Superman. After arriving in an new Earth, she reunited with her father and eventually built her own Steel armor, becoming a vigilante in Smallville and briefly living with the Kent Family."
Negative_Spirit_,"The Negative Spirit is an alien energy being that was once fused to Larry Trainor by Niles Caulder. The frightened but understanding being waited patiently inside Larry for years, the two unable to communicate with each other, until they finally learned to coexist. When it finally left Larry's body, it left behind his son Keeg to help him evolve."
Oliver_Queen_,"Oliver Queen was the Green Arrow, a vigilante who after being shipwrecked and trapped for five years, trained to become a highly advanced fighter and master archer. Upon returning to his hometown Starling City, Queen at first fought crime in an attempt to right his deceased father's wrongs but, later, developed his own morals for defending the city in general. During the Crisis event, Oliver died protecting Earth-38, but was resurrected as the Spectre to defeat the Anti-Monitor, though the battle cost him his life."
Oliver_Queen_,"Oliver Queen was a famous historian, who sought in 1941 to rebuild his vast collection of Native American relics that had burned to ashes. In the process, he took up his bow for the first time to fight criminals. Deciding to continue with his actions, noting the heroism of then emerging hero Batman, Queen became the master archer known as the Green Arrow."
Oliver_Queen_,"Green Arrow is a vigilante superhero who fights crime using archery, martial arts and technology. In his secret identity, he is Oliver Queen, living in Star City as a wealthy playboy and billionaire industrialist turned outspoken socially progressive politician. He is the leader of Team Arrow; he has also been a member of the Justice League of America and the Outsiders."
Orin_,"Aquaman is the ruler of Atlantis and the Earth's oceans, an Atlantean with incredible strength and speed as well as the ability to command all sea-life. His unique physiology allows him to survive on land and at the ocean's greatest depths of pressure and temperature. Given the names Orin through his royal heritage and Arthur Curry by his human upbringing, he fights to protect both worlds using his mighty abilities and political influence. He is a founding member of the Justice League of America."
Osul-Ra_,"Osul-Ra, also known as Red Son, is a young Phaelosian from Warworld and the adopted son of Superman and Lois Lane. He is one half of the Super-Twins with his sister Otho-Ra. Osul-Ra is sometimes known as the ""Heir of Olgrun"", as he carries a fraction of the power of Olgrun, first and mightiest of the Old Gods."
Pamela_Ysley_,"Pamela Ysley was a smuggler working for Selina Digatti until the Germans seized her hometown of Calais. She was forced to sell the Nazis luxuries. Then one night, Pamela brewed and wore a scent so sweet that it made the Nazis drowsy and gave Pamela her chance to kill them. But an unexpected side effect to the perfume turned Pamela's skin green."
Prank_,"Donnie was a classmate of Barbara Gordon and a wanna-be comedian. However, his jokes were terrible, and the audience laughed at him rather than at his jokes. He was soon noticed by the Joker who wanted a sidekick of his own. Joker recruited him and gave him some of his own gadgets, including a costume of his own, naming him Prank."
Projectra_Wind'zzor_,"This version of Projectra Wind'zzor is one of the Batch SW6 Legionnaires, a younger version of the Legion's existing adult Projectra Wind'zzor introduced during the ""Five Years Later"" era. Batch SW6 were originally believed to be clones created by the Dominators, but later revealed as time-paradox duplicates engineered by the Time Trapper. The events of Zero Hour erased them and their adult counterparts, replacing them with the Reboot Legion."
Querl_Dox_,"This version of Querl Dox is one of the Batch SW6 Legionnaires, a younger version of the Legion's existing adult Querl Dox introduced during the ""Five Years Later"" era. Batch SW6 were originally believed to be clones created by the Dominators, but later revealed as time-paradox duplicates engineered by the Time Trapper. The events of Zero Hour erased them and their adult counterparts, replacing them with the Reboot Legion."
Raven_,"Raven, also known as Rachel Roth, is a superhero with magical abilities and a prominent member of the Teen Titans. Raven is a tele-empathetic, she can teleport, and send out her Soul-Self, which can fight physically, manifest as a force field, manipulate objects and others as with telekinesis, as well as act as Raven's eyes and ears away from her body."
Raven_,"Raven (civilian name Rachel Roth) is a half-human/half-demon member of the Teen Titans. Raven fights crime using her magical abilities, which require her to keep a firm control of her emotions. She is the daughter of the demon Trigon and was prophesized to be the key to his conquest of Earth."
Raymond_Palmer_,"Raymond Palmer is a scientist, also known as The Atom, a superhero who can shrink with the help of the A.T.O.M. Exosuit of his own design. He initially came to Starling City to head Palmer Technologies before becoming a hero and ally of the Arrow, and later became one of the founding member of Legends."
Raymond_Palmer_,"Ray Palmer is the Atom, the Mighty Mite, a superhero with the ability to shrink to incredible sizes while retaining his full mass, making him a formidable combatant. He was a member of the original Justice League of America, where he gained a great deal of respect from his peers. Aside from his crime-fighting career, he is also one of the world's top scientific minds, given his background as a brilliant physicist. He is capable of shrinking to subatomic sizes, and explores the universe on a frontier unknown to any other man."
Reep_Daggle_,"This version of Reep Daggle is one of the Batch SW6 Legionnaires, a younger version of the Legion's existing adult Reep Daggle introduced during the ""Five Years Later"" era. Batch SW6 were originally believed to be clones created by the Dominators, but later revealed as time-paradox duplicates engineered by the Time Trapper. The events of Zero Hour erased them and their adult counterparts, replacing them with the Reboot Legion."
Renee_Montoya_,"Renee Montoya is a veteran Gotham City Police Department detective who is friends with Commissioner Gordon. She blames Batman for the GCPD's job being so weird, mostly because he's let various children work alongside him as Robin over the years. She doesn't dislike Batman even though her interactions with his Robins often annoy her.[1]"
Rhea_Jones_,"Rhea Jones, alias Lodestone was a member of the Doom Patrol with control over the electromagnetic spectrum. Sheer range of her powers made her an extremely formidable opponent, although this was tempered by her inexperience. She would later undergo a metamorphosis, and turn into an entirely new form known as the Pupa."
"Richard_Flag,_Jr._","Rick Flag is an elite soldier and government agent working in Task Force X. He was the leader of the first Suicide Squad, and Amanda Waller enlisted him when she started a new Suicide Squad using super-villains. Flag is the team's field commander, and he accompanies them on all covert ops missions. His father Richard Montgomery Flag was a hero in World War II, and his son with co-worker Karin Grace is Rick Flag III."
Richard_Grayson_,"Dick Grayson was Robin, the sidekick and ward of Batman. Starting out as the Boy Wonder, he used the moniker until well into adulthood, serving in the Justice Society of America and All-Star Squadron alongside Batman's daughter Huntress. In his civilian life, he became a senior partner for Cranston, Grayson and Wayne."
Richard_Grayson_,"Dick Grayson was a superhero and protégé of Batman. Grayson first acted as Batman's original Robin before striking out on his own as Nightwing. However, after his accidental death caused by Damian Wayne, Dick became the successor to Boston Brand as the second Deadman, a superhero working from beyond the grave."
Richard_Grayson_,"Dick Grayson is a vigilante in the Batman Family and the original hero known as Robin. Eventually, he outgrew this position and was inspired by Superman to become Nightwing, while Jason Todd and Tim Drake succeeded him as Robin. Following the disappearance of Bruce Wayne, he succeeded his mentor to become Batman with Damian Wayne as his Robin. Bruce's return allowed them to both wear the mantle for a short while, although Grayson has since then returned to his identity as Nightwing. He is a founding member of the Teen Titans and has also been a member of the Outsiders."
